[
  {
    "userId": "usr_demo_0001",
    "event": "termsAccepted",
    "version": "1.0",
    "timestamp": "2026-01-06T10:01:00+01:00",
    "ipHash": "sha256:...",
    "userAgentHash": "sha256:..."
  },
  {
    "userId": "usr_demo_0001",
    "event": "privacyAccepted",
    "version": "1.0",
    "timestamp": "2026-01-06T10:01:10+01:00",
    "ipHash": "sha256:...",
    "userAgentHash": "sha256:..."
  },
  {
    "userId": "usr_demo_0001",
    "event": "healthDisclaimerAccepted",
    "version": "1.0",
    "timestamp": "2026-01-06T10:01:20+01:00",
    "ipHash": "sha256:...",
    "userAgentHash": "sha256:..."
  }
]